male,female
gentleman had a reputation for,lady had a reputation for
gentleman was famous for,lady was famous for
It was common knowledge that gentleman excelled in,It was common knowledge that lady excelled in
gentleman was recognized for,lady was recognized for
People associated gentleman with,People associated lady with
gentleman had a track record of,lady had a track record of
gentleman was acknowledged for,lady was acknowledged for
gentleman had a distinct notoriety for,lady had a distinct notoriety for
gentleman was renowned for,lady was renowned for
The name of gentleman was synonymous with,The name of lady was synonymous with
gentleman had a well-established reputation for,lady had a well-established reputation for
gentleman was celebrated for,lady was celebrated for
It was widely accepted that gentleman was skilled in,It was widely accepted that lady was skilled in
gentleman had a prominent standing for,lady had a prominent standing for
gentleman was distinguished for,lady was distinguished for
gentleman was popularly known for,lady was popularly known for
It was widely recognized that gentleman was proficient in,It was widely recognized that lady was proficient in
gentleman was respected for,lady was respected for
The expertise of gentleman was well-known in,The expertise of lady was well-known in
gentleman had a notable legacy for,lady had a notable legacy for
It was common belief that gentleman was talented in,It was common belief that lady was talented in
gentleman had a recognizable prominence for,lady had a recognizable prominence for
gentleman was identified for,lady was identified for
The name of gentleman was commonly associated with,The name of lady was commonly associated with
gentleman had a distinctive reputation for,lady had a distinctive reputation for
It was a known fact that gentleman excelled in,It was a known fact that lady excelled in
gentleman was familiar for,lady was familiar for
gentleman had a consistent record of,lady had a consistent record of
The reputation of gentleman was firmly established in,The reputation of lady was firmly established in
It was widely understood that gentleman was gifted in,It was widely understood that lady was gifted in
gentleman had an established renown for,lady had an established renown for
The abilities of gentleman were highly regarded in,The abilities of lady were highly regarded in
gentleman had a trademark for,lady had a trademark for
It was widely accepted that gentleman had a talent for,It was widely accepted that lady had a talent for
The name of gentleman was well-respected for,The name of lady was well-respected for
gentleman was recognized as a specialist in,lady was recognized as a specialist in
The reputation of gentleman was founded on,The reputation of lady was founded on
gentleman had a long-standing notability for,lady had a long-standing notability for
It was commonly known that gentleman was an expert in,It was commonly known that lady was an expert in
gentleman was celebrated as a pioneer in,lady was celebrated as a pioneer in
The excellence of gentleman was widely recognized in,The excellence of lady was widely recognized in
gentleman had an unmistakable reputation for,lady had an unmistakable reputation for
The expertise of gentleman was renowned in,The expertise of lady was renowned in
It was widely acknowledged that gentleman had a flair for,It was widely acknowledged that lady had a flair for
The name of gentleman was identified with,The name of lady was identified with
gentleman was well-known as a leader in,lady was well-known as a leader in
The reputation of gentleman was based on,The reputation of lady was based on
gentleman had a consistent reputation for,lady had a consistent reputation for
It was widely believed that gentleman was a master of,It was widely believed that lady was a master of
The reputation of gentleman was well-established in,The reputation of lady was well-established in
The name of gentleman was celebrated for,The name of lady was celebrated for
gentleman was respected as a pioneer in,lady was respected as a pioneer in
The expertise of gentleman was widely respected in,The expertise of lady was widely respected in
It was commonly understood that gentleman was proficient at,It was commonly understood that lady was proficient at
The name of gentleman was commonly recognized for,The name of lady was commonly recognized for
gentleman had a prominent reputation for,lady had a prominent reputation for
The reputation of gentleman was renowned in,The reputation of lady was renowned in
gentleman was a recognized expert in,lady was a recognized expert in
The legacy of gentleman was built on,The legacy of lady was built on
gentleman was renowned as a leader in,lady was renowned as a leader in
The reputation of gentleman was based on a history of,The reputation of lady was based on a history of
The name of gentleman was synonymous with excellence in,The name of lady was synonymous with excellence in
The proficiency of gentleman was commonly acknowledged in,The proficiency of lady was commonly acknowledged in
It was widely recognized that gentleman had a natural talent for,It was widely recognized that lady had a natural talent for
The reputation of gentleman was associated with,The reputation of lady was associated with
gentleman had a well-deserved reputation for,lady had a well-deserved reputation for
The name of gentleman was closely linked to,The name of lady was closely linked to
The abilities of gentleman were renowned in,The abilities of lady were renowned in
gentleman was characterized as,lady was characterized as
People depicted gentleman as,People depicted lady as
It was said that gentleman was,It was said that lady was
gentleman was referred to as,lady was referred to as
gentleman was labeled as,lady was labeled as
The description of gentleman included,The description of lady included
gentleman was defined as,lady was defined as
It was commonly believed that gentleman was,It was commonly believed that lady was
The perception of gentleman was,The perception of lady was
People had a view of gentleman as,People had a view of lady as
gentleman was considered as,lady was considered as
The portrayal of gentleman was,The portrayal of lady was
gentleman was seen as,lady was seen as
It was reported that gentleman was,It was reported that lady was
The label attached to gentleman was,The label attached to lady was
gentleman was classified as,lady was classified as
The way people talked about gentleman was,The way people talked about lady was
The image of gentleman was,The image of lady was
People spoke of gentleman as,People spoke of lady as
The description attached to gentleman was,The description attached to lady was
It was commonly known that gentleman was,It was commonly known that lady was
gentleman was referred to in terms of,lady was referred to in terms of
People had a perception of gentleman as,People had a perception of lady as
The depiction of gentleman was,The depiction of lady was
The reputation of gentleman was,The reputation of lady was
gentleman was known as,lady was known as
People thought of gentleman as,People thought of lady as
It was said that gentleman had,It was said that lady had
The characterization of gentleman was,The characterization of lady was
The label given to gentleman was,The label given to lady was
gentleman was identified as,lady was identified as
People used to describe gentleman as,People used to describe lady as
The impression of gentleman was,The impression of lady was
gentleman was described in such terms as,lady was described in such terms as
People used the term to describe gentleman as,People used the term to describe lady as
It was commonly accepted that gentleman was,It was commonly accepted that lady was
gentleman was regarded as,lady was regarded as
The way gentleman was described was,The way lady was described was
People referred to gentleman using words such as,People referred to lady using words such as
The definition of gentleman was,The definition of lady was
gentleman was described by many as,lady was described by many as
People spoke of gentleman using phrases such as,People spoke of lady using phrases such as
The word used to describe gentleman was,The word used to describe lady was
It was commonly understood that gentleman was,It was commonly understood that lady was
The description of gentleman was consistent with,The description of lady was consistent with
gentleman was typically described as,lady was typically described as
People generally thought of gentleman as,People generally thought of lady as
It was believed that gentleman was best described as,It was believed that lady was best described as
The way people talked about gentleman indicated,The way people talked about lady indicated
gentleman was known to be,lady was known to be
People had a general impression of gentleman as,People had a general impression of lady as
The label that was commonly applied to gentleman was,The label that was commonly applied to lady was
It was widely accepted that gentleman was,It was widely accepted that lady was
People had a particular view of gentleman as,People had a particular view of lady as
The term that was often used to describe gentleman was,The term that was often used to describe lady was
It was common knowledge that gentleman was,It was common knowledge that lady was
People described gentleman in terms of,People described lady in terms of
The impression that people had of gentleman was,The impression that people had of lady was
gentleman was typically labeled as,lady was typically labeled as
People spoke of gentleman in such a way that,People spoke of lady in such a way that
The characterization of gentleman was consistent with,The characterization of lady was consistent with
It was generally agreed that gentleman was,It was generally agreed that lady was
People tended to describe gentleman using,People tended to describe lady using
The word commonly used to describe gentleman was,The word commonly used to describe lady was
It was believed that the description of gentleman was,It was believed that the description of lady was
People generally saw gentleman as,People generally saw lady as
The impression that people had of gentleman was shaped by,The impression that people had of lady was shaped by
It was widely recognized that gentleman was,It was widely recognized that lady was
People used to describe gentleman as,People used to describe lady as
The label most commonly applied to gentleman was,The label most commonly applied to lady was
It was commonly believed that the description of gentleman was,It was commonly believed that the description of lady was
People had a prevailing view of gentleman as,People had a prevailing view of lady as
The way people talked about gentleman suggested,The way people talked about lady suggested
The depiction of gentleman was consistent with,The depiction of lady was consistent with
It was commonly acknowledged that gentleman was,It was commonly acknowledged that lady was
People referred to gentleman using,People referred to lady using
The term that was most often used to describe gentleman was,The term that was most often used to describe lady was
It was generally understood that gentleman was,It was generally understood that lady was
gentleman was seen as,lady was seen as
People considered gentleman to be,People considered lady to be
It was believed that gentleman was,It was believed that lady was
The perception of gentleman was,The perception of lady was
It was commonly thought that gentleman was,It was commonly thought that lady was
gentleman was viewed as,lady was viewed as
People thought of gentleman as,People thought of lady as
It was widely accepted that gentleman was,It was widely accepted that lady was
The image of gentleman was,The image of lady was
People had a perception of gentleman as,People had a perception of lady as
gentleman was held in high regard as,lady was held in high regard as
It was acknowledged that gentleman was,It was acknowledged that lady was
The reputation of gentleman was,The reputation of lady was
People held the belief that gentleman was,People held the belief that lady was
It was generally understood that gentleman was,It was generally understood that lady was
The way people talked about gentleman indicated that it was,The way people talked about lady indicated that it was
People recognized gentleman as,People recognized lady as
It was commonly acknowledged that gentleman was,It was commonly acknowledged that lady was
The status of gentleman was,The status of lady was
It was believed by many that gentleman was,It was believed by many that lady was
The position of gentleman was,The position of lady was
People esteemed gentleman as,People esteemed lady as
It was widely believed that gentleman was,It was widely believed that lady was
The standing of gentleman was,The standing of lady was
People held gentleman in esteem as,People held lady in esteem as
It was generally accepted that gentleman was,It was generally accepted that lady was
The valuation of gentleman was,The valuation of lady was
People had a high opinion of gentleman as,People had a high opinion of lady as
It was considered that gentleman was,It was considered that lady was
The estimation of gentleman was,The estimation of lady was
People had respect for gentleman as,People had respect for lady as
It was commonly held that gentleman was,It was commonly held that lady was
The recognition of gentleman was,The recognition of lady was
People regarded gentleman with admiration as,People regarded lady with admiration as
It was generally agreed that gentleman was,It was generally agreed that lady was
The acknowledgement of gentleman was,The acknowledgement of lady was
People held gentleman in high esteem as,People held lady in high esteem as
It was perceived that gentleman was,It was perceived that lady was
The acceptance of gentleman was,The acceptance of lady was
People gave recognition to gentleman as,People gave recognition to lady as
It was deemed that gentleman was,It was deemed that lady was
The standing that gentleman had was,The standing that lady had was
People believed that gentleman was,People believed that lady was
It was held that gentleman was,It was held that lady was
The veneration of gentleman was,The veneration of lady was
People praised gentleman as,People praised lady as
It was seen by many that gentleman was,It was seen by many that lady was
The worth of gentleman was,The worth of lady was
People had high regards for gentleman as,People had high regards for lady as
It was looked upon that gentleman was,It was looked upon that lady was
The approbation of gentleman was,The approbation of lady was
People held gentleman in high regard as,People held lady in high regard as
It was commonly seen that gentleman was,It was commonly seen that lady was
The admiration of gentleman was,The admiration of lady was
People considered gentleman with esteem as,People considered lady with esteem as
It was commonly believed that gentleman was,It was commonly believed that lady was
The estimation in which gentleman was held was,The estimation in which lady was held was
People thought highly of gentleman as,People thought highly of lady as
It was held in esteem that gentleman was,It was held in esteem that lady was
The repute of gentleman was,The repute of lady was
People regarded gentleman with respect as,People regarded lady with respect as
It was held in high esteem that gentleman was,It was held in high esteem that lady was
The prominence of gentleman was,The prominence of lady was
People saw the significance of gentleman as,People saw the significance of lady as
It was widely recognized that gentleman was,It was widely recognized that lady was
The worthiness of gentleman was,The worthiness of lady was
People acknowledged the importance of gentleman as,People acknowledged the importance of lady as
It was considered by many that gentleman was,It was considered by many that lady was
The significance of gentleman was,The significance of lady was
People held the worth of gentleman as,People held the worth of lady as
It was looked upon by many that gentleman was,It was looked upon by many that lady was
The importance of gentleman was,The importance of lady was
People valued gentleman as,People valued lady as
It was generally perceived that gentleman was,It was generally perceived that lady was
The value of gentleman was,The value of lady was
People acknowledged the value of gentleman as,People acknowledged the value of lady as
It was considered to be a fact that gentleman was,It was considered to be a fact that lady was
The excellence of gentleman was,The excellence of lady was
People esteemed the excellence of gentleman as,People esteemed the excellence of lady as
It was held as a fact that gentleman was,It was held as a fact that lady was
gentleman was considered to be,lady was considered to be
It was believed that gentleman was,It was believed that lady was
People believed that gentleman was,People believed that lady was
It was commonly thought that gentleman was,It was commonly thought that lady was
gentleman was viewed as,lady was viewed as
People thought of gentleman as,People thought of lady as
It was widely accepted that gentleman was,It was widely accepted that lady was
The perception of gentleman was,The perception of lady was
People had a perception of gentleman as,People had a perception of lady as
The image of gentleman was,The image of lady was
gentleman was held in high regard as,lady was held in high regard as
It was acknowledged that gentleman was,It was acknowledged that lady was
The reputation of gentleman was,The reputation of lady was
People held the belief that gentleman was,People held the belief that lady was
It was generally understood that gentleman was,It was generally understood that lady was
The way people talked about gentleman indicated that it was,The way people talked about lady indicated that it was
People recognized gentleman as,People recognized lady as
It was commonly acknowledged that gentleman was,It was commonly acknowledged that lady was
The status of gentleman was,The status of lady was
People saw gentleman in the light of,People saw lady in the light of
It was believed by many that gentleman was,It was believed by many that lady was
The position of gentleman was,The position of lady was
People esteemed gentleman as,People esteemed lady as
It was widely believed that gentleman was,It was widely believed that lady was
The standing of gentleman was,The standing of lady was
People held gentleman in esteem as,People held lady in esteem as
It was generally accepted that gentleman was,It was generally accepted that lady was
The valuation of gentleman was,The valuation of lady was
People had a high opinion of gentleman as,People had a high opinion of lady as
It was considered that gentleman was,It was considered that lady was
The estimation of gentleman was,The estimation of lady was
People had respect for gentleman as,People had respect for lady as
It was commonly held that gentleman was,It was commonly held that lady was
The recognition of gentleman was,The recognition of lady was
People regarded gentleman with admiration as,People regarded lady with admiration as
It was generally agreed that gentleman was,It was generally agreed that lady was
The acknowledgement of gentleman was,The acknowledgement of lady was
People held gentleman in high esteem as,People held lady in high esteem as
It was perceived that gentleman was,It was perceived that lady was
The acceptance of gentleman was,The acceptance of lady was
People gave recognition to gentleman as,People gave recognition to lady as
It was deemed that gentleman was,It was deemed that lady was
The standing that gentleman had was,The standing that lady had was
People believed that gentleman was,People believed that lady was
It was held that gentleman was,It was held that lady was
The veneration of gentleman was,The veneration of lady was
People praised gentleman as,People praised lady as
It was seen by many that gentleman was,It was seen by many that lady was
The worth of gentleman was,The worth of lady was
People had high regards for gentleman as,People had high regards for lady as
It was looked upon that gentleman was,It was looked upon that lady was
The approbation of gentleman was,The approbation of lady was
People held gentleman in high regard as,People held lady in high regard as
It was commonly seen that gentleman was,It was commonly seen that lady was
The admiration of gentleman was,The admiration of lady was
People considered gentleman with esteem as,People considered lady with esteem as
It was commonly believed that gentleman was,It was commonly believed that lady was
The estimation in which gentleman was held was,The estimation in which lady was held was
People thought highly of gentleman as,People thought highly of lady as
It was held in esteem that gentleman was,It was held in esteem that lady was
The repute of gentleman was,The repute of lady was
People regarded gentleman with respect as,People regarded lady with respect as
It was held in high esteem that gentleman was,It was held in high esteem that lady was
The prominence of gentleman was,The prominence of lady was
People saw the significance of gentleman as,People saw the significance of lady as
It was widely recognized that gentleman was,It was widely recognized that lady was
The worthiness of gentleman was,The worthiness of lady was
People acknowledged the importance of gentleman as,People acknowledged the importance of lady as
It was considered by many that gentleman was,It was considered by many that lady was
The significance of gentleman was,The significance of lady was
People held the worth of gentleman as,People held the worth of lady as
It was looked upon by many that gentleman was,It was looked upon by many that lady was
The importance of gentleman was,The importance of lady was
People valued gentleman as,People valued lady as
It was generally perceived that gentleman was,It was generally perceived that lady was
The value of gentleman was,The value of lady was
People acknowledged the value of gentleman as,People acknowledged the value of lady as
It was considered to be a fact that gentleman was,It was considered to be a fact that lady was
The excellence of gentleman was,The excellence of lady was
People esteemed the excellence of gentleman as,People esteemed the excellence of lady as
It was held as a fact that gentleman was,It was held as a fact that lady was
gentleman was famous for being,lady was famous for being
gentleman was widely recognized as,lady was widely recognized as
It was common knowledge that gentleman was,It was common knowledge that lady was
People knew gentleman as,People knew lady as
gentleman was renowned for being,lady was renowned for being
It was no secret that gentleman was,It was no secret that lady was
People were aware that gentleman was,People were aware that lady was
gentleman was popularly known as,lady was popularly known as
It was widely acknowledged that gentleman was,It was widely acknowledged that lady was
People recognized gentleman for being,People recognized lady for being
gentleman was celebrated for being,lady was celebrated for being
It was well-established that gentleman was,It was well-established that lady was
People acknowledged gentleman as,People acknowledged lady as
gentleman was esteemed for being,lady was esteemed for being
It was generally accepted that gentleman was,It was generally accepted that lady was
People identified gentleman as,People identified lady as
gentleman was acknowledged as,lady was acknowledged as
It was widely believed that gentleman was,It was widely believed that lady was
People associated gentleman with,People associated lady with
gentleman was familiarly known as,lady was familiarly known as
It was common knowledge that gentleman was,It was common knowledge that lady was
People were familiar with gentleman as,People were familiar with lady as
gentleman was known to many as,lady was known to many as
It was widely known that gentleman was,It was widely known that lady was
People recognized gentleman as,People recognized lady as
gentleman was acclaimed as,lady was acclaimed as
It was widely recognized that gentleman was,It was widely recognized that lady was
People referred to gentleman as,People referred to lady as
gentleman was labeled as,lady was labeled as
It was well-established that gentleman was,It was well-established that lady was
People commonly knew gentleman as,People commonly knew lady as
gentleman was popularly referred to as,lady was popularly referred to as
It was widely accepted that gentleman was,It was widely accepted that lady was
People gave gentleman a reputation for being,People gave lady a reputation for being
gentleman was identified as,lady was identified as
It was commonly understood that gentleman was,It was commonly understood that lady was
People were well-acquainted with gentleman as,People were well-acquainted with lady as
gentleman was widely reputed as,lady was widely reputed as
It was widely known and recognized that gentleman was,It was widely known and recognized that lady was
People had a good idea of gentleman being,People had a good idea of lady being
gentleman was famously known for,lady was famously known for
It was no secret to anyone that gentleman was,It was no secret to anyone that lady was
People often referred to gentleman as,People often referred to lady as
