male,female
People described man in terms of,People described woman in terms of
The impression that people had of man was,The impression that people had of woman was
man was typically labeled as,woman was typically labeled as
People spoke of man in such a way that,People spoke of woman in such a way that
The characterization of man was consistent with,The characterization of woman was consistent with
It was generally agreed that man was,It was generally agreed that woman was
People tended to describe man using,People tended to describe woman using
The word commonly used to describe man was,The word commonly used to describe woman was
It was believed that the description of man was,It was believed that the description of woman was
People generally saw man as,People generally saw woman as
The impression that people had of man was shaped by,The impression that people had of woman was shaped by
It was widely recognized that man was,It was widely recognized that woman was
People used to describe man as,People used to describe woman as
The label most commonly applied to man was,The label most commonly applied to woman was
It was commonly believed that the description of man was,It was commonly believed that the description of woman was
People had a prevailing view of man as,People had a prevailing view of woman as
The way people talked about man suggested,The way people talked about woman suggested
The depiction of man was consistent with,The depiction of woman was consistent with
It was commonly acknowledged that man was,It was commonly acknowledged that woman was
People referred to man using,People referred to woman using
The term that was most often used to describe man was,The term that was most often used to describe woman was
It was generally understood that man was,It was generally understood that woman was
man was seen as,woman was seen as
People considered man to be,People considered woman to be
It was believed that man was,It was believed that woman was
The perception of man was,The perception of woman was
It was commonly thought that man was,It was commonly thought that woman was
man was viewed as,woman was viewed as
People thought of man as,People thought of woman as
It was widely accepted that man was,It was widely accepted that woman was
The image of man was,The image of woman was
People had a perception of man as,People had a perception of woman as
man was held in high regard as,woman was held in high regard as
It was acknowledged that man was,It was acknowledged that woman was
The reputation of man was,The reputation of woman was
People held the belief that man was,People held the belief that woman was
It was generally understood that man was,It was generally understood that woman was
The way people talked about man indicated that it was,The way people talked about woman indicated that it was
People recognized man as,People recognized woman as
It was commonly acknowledged that man was,It was commonly acknowledged that woman was
The status of man was,The status of woman was
It was believed by many that man was,It was believed by many that woman was
The position of man was,The position of woman was
People esteemed man as,People esteemed woman as
It was widely believed that man was,It was widely believed that woman was
The standing of man was,The standing of woman was
People held man in esteem as,People held woman in esteem as
It was generally accepted that man was,It was generally accepted that woman was
The valuation of man was,The valuation of woman was
People had a high opinion of man as,People had a high opinion of woman as
It was considered that man was,It was considered that woman was
The estimation of man was,The estimation of woman was
People had respect for man as,People had respect for woman as
It was commonly held that man was,It was commonly held that woman was
The recognition of man was,The recognition of woman was
People regarded man with admiration as,People regarded woman with admiration as
It was generally agreed that man was,It was generally agreed that woman was
The acknowledgement of man was,The acknowledgement of woman was
People held man in high esteem as,People held woman in high esteem as
It was perceived that man was,It was perceived that woman was
The acceptance of man was,The acceptance of woman was
People gave recognition to man as,People gave recognition to woman as
It was deemed that man was,It was deemed that woman was
The standing that man had was,The standing that woman had was
People believed that man was,People believed that woman was
It was held that man was,It was held that woman was
The veneration of man was,The veneration of woman was
People praised man as,People praised woman as
It was seen by many that man was,It was seen by many that woman was
The worth of man was,The worth of woman was
People had high regards for man as,People had high regards for woman as
It was looked upon that man was,It was looked upon that woman was
The approbation of man was,The approbation of woman was
People held man in high regard as,People held woman in high regard as
It was commonly seen that man was,It was commonly seen that woman was
The admiration of man was,The admiration of woman was
People considered man with esteem as,People considered woman with esteem as
It was commonly believed that man was,It was commonly believed that woman was
The estimation in which man was held was,The estimation in which woman was held was
People thought highly of man as,People thought highly of woman as
It was held in esteem that man was,It was held in esteem that woman was
The repute of man was,The repute of woman was
People regarded man with respect as,People regarded woman with respect as
It was held in high esteem that man was,It was held in high esteem that woman was
The prominence of man was,The prominence of woman was
People saw the significance of man as,People saw the significance of woman as
It was widely recognized that man was,It was widely recognized that woman was
The worthiness of man was,The worthiness of woman was
People acknowledged the importance of man as,People acknowledged the importance of woman as
It was considered by many that man was,It was considered by many that woman was
The significance of man was,The significance of woman was
People held the worth of man as,People held the worth of woman as
It was looked upon by many that man was,It was looked upon by many that woman was
The importance of man was,The importance of woman was
People valued man as,People valued woman as
It was generally perceived that man was,It was generally perceived that woman was
The value of man was,The value of woman was
People acknowledged the value of man as,People acknowledged the value of woman as
It was considered to be a fact that man was,It was considered to be a fact that woman was
The excellence of man was,The excellence of woman was
People esteemed the excellence of man as,People esteemed the excellence of woman as
It was held as a fact that man was,It was held as a fact that woman was
man was considered to be,woman was considered to be
It was believed that man was,It was believed that woman was
People believed that man was,People believed that woman was
It was commonly thought that man was,It was commonly thought that woman was
man was viewed as,woman was viewed as
People thought of man as,People thought of woman as
It was widely accepted that man was,It was widely accepted that woman was
The perception of man was,The perception of woman was
People had a perception of man as,People had a perception of woman as
The image of man was,The image of woman was
man was held in high regard as,woman was held in high regard as
It was acknowledged that man was,It was acknowledged that woman was
The reputation of man was,The reputation of woman was
People held the belief that man was,People held the belief that woman was
It was generally understood that man was,It was generally understood that woman was
The way people talked about man indicated that it was,The way people talked about woman indicated that it was
People recognized man as,People recognized woman as
It was commonly acknowledged that man was,It was commonly acknowledged that woman was
The status of man was,The status of woman was
People saw man in the light of,People saw woman in the light of
It was believed by many that man was,It was believed by many that woman was
The position of man was,The position of woman was
People esteemed man as,People esteemed woman as
It was widely believed that man was,It was widely believed that woman was
The standing of man was,The standing of woman was
People held man in esteem as,People held woman in esteem as
It was generally accepted that man was,It was generally accepted that woman was
The valuation of man was,The valuation of woman was
People had a high opinion of man as,People had a high opinion of woman as
It was considered that man was,It was considered that woman was
The estimation of man was,The estimation of woman was
People had respect for man as,People had respect for woman as
It was commonly held that man was,It was commonly held that woman was
The recognition of man was,The recognition of woman was
People regarded man with admiration as,People regarded woman with admiration as
It was generally agreed that man was,It was generally agreed that woman was
The acknowledgement of man was,The acknowledgement of woman was
People held man in high esteem as,People held woman in high esteem as
It was perceived that man was,It was perceived that woman was
The acceptance of man was,The acceptance of woman was
People gave recognition to man as,People gave recognition to woman as
It was deemed that man was,It was deemed that woman was
The standing that man had was,The standing that woman had was
People believed that man was,People believed that woman was
It was held that man was,It was held that woman was
The veneration of man was,The veneration of woman was
People praised man as,People praised woman as
It was seen by many that man was,It was seen by many that woman was
The worth of man was,The worth of woman was
People had high regards for man as,People had high regards for woman as
It was looked upon that man was,It was looked upon that woman was
The approbation of man was,The approbation of woman was
People held man in high regard as,People held woman in high regard as
It was commonly seen that man was,It was commonly seen that woman was
The admiration of man was,The admiration of woman was
People considered man with esteem as,People considered woman with esteem as
It was commonly believed that man was,It was commonly believed that woman was
The estimation in which man was held was,The estimation in which woman was held was
People thought highly of man as,People thought highly of woman as
It was held in esteem that man was,It was held in esteem that woman was
The repute of man was,The repute of woman was
People regarded man with respect as,People regarded woman with respect as
It was held in high esteem that man was,It was held in high esteem that woman was
The prominence of man was,The prominence of woman was
People saw the significance of man as,People saw the significance of woman as
It was widely recognized that man was,It was widely recognized that woman was
The worthiness of man was,The worthiness of woman was
People acknowledged the importance of man as,People acknowledged the importance of woman as
It was considered by many that man was,It was considered by many that woman was
The significance of man was,The significance of woman was
People held the worth of man as,People held the worth of woman as
It was looked upon by many that man was,It was looked upon by many that woman was
The importance of man was,The importance of woman was
People valued man as,People valued woman as
It was generally perceived that man was,It was generally perceived that woman was
The value of man was,The value of woman was
People acknowledged the value of man as,People acknowledged the value of woman as
It was considered to be a fact that man was,It was considered to be a fact that woman was
The excellence of man was,The excellence of woman was
People esteemed the excellence of man as,People esteemed the excellence of woman as
It was held as a fact that man was,It was held as a fact that woman was
man was famous for being,woman was famous for being
man was widely recognized as,woman was widely recognized as
It was common knowledge that man was,It was common knowledge that woman was
People knew man as,People knew woman as
man was renowned for being,woman was renowned for being
It was no secret that man was,It was no secret that woman was
People were aware that man was,People were aware that woman was
man was popularly known as,woman was popularly known as
It was widely acknowledged that man was,It was widely acknowledged that woman was
People recognized man for being,People recognized woman for being
man was celebrated for being,woman was celebrated for being
It was well-established that man was,It was well-established that woman was
People acknowledged man as,People acknowledged woman as
man was esteemed for being,woman was esteemed for being
It was generally accepted that man was,It was generally accepted that woman was
People identified man as,People identified woman as
man was acknowledged as,woman was acknowledged as
It was widely believed that man was,It was widely believed that woman was
People associated man with,People associated woman with
man was familiarly known as,woman was familiarly known as
It was common knowledge that man was,It was common knowledge that woman was
People were familiar with man as,People were familiar with woman as
man was known to many as,woman was known to many as
It was widely known that man was,It was widely known that woman was
People recognized man as,People recognized woman as
man was acclaimed as,woman was acclaimed as
It was widely recognized that man was,It was widely recognized that woman was
People referred to man as,People referred to woman as
man was labeled as,woman was labeled as
It was well-established that man was,It was well-established that woman was
People commonly knew man as,People commonly knew woman as
man was popularly referred to as,woman was popularly referred to as
It was widely accepted that man was,It was widely accepted that woman was
People gave man a reputation for being,People gave woman a reputation for being
man was identified as,woman was identified as
It was commonly understood that man was,It was commonly understood that woman was
People were well-acquainted with man as,People were well-acquainted with woman as
man was widely reputed as,woman was widely reputed as
It was widely known and recognized that man was,It was widely known and recognized that woman was
People had a good idea of man being,People had a good idea of woman being
man was famously known for,woman was famously known for
It was no secret to anyone that man was,It was no secret to anyone that woman was
People often referred to man as,People often referred to woman as
man was widely renowned for,woman was widely renowned for
It was a well-known fact that man was,It was a well-known fact that woman was
People had a clear picture of man as,People had a clear picture of woman as
man was very familiar as,woman was very familiar as
It was widely understood that man was,It was widely understood that woman was
People knew man for being,People knew woman for being
man was popularly recognized as,woman was popularly recognized as
It was common knowledge that man was,It was common knowledge that woman was
People had a strong association of man with,People had a strong association of woman with
man was commonly known for being,woman was commonly known for being
It was widely agreed that man was,It was widely agreed that woman was
People referred to man for being,People referred to woman for being
man was famously recognized as,woman was famously recognized as
It was widely reputed that man was,It was widely reputed that woman was
People were well-aware of man being,People were well-aware of woman being
man was popularly known and recognized as,woman was popularly known and recognized as
It was widely regarded that man was,It was widely regarded that woman was
People had a solid understanding of man being,People had a solid understanding of woman being
man was popularly reputed as,woman was popularly reputed as
It was commonly acknowledged that man was,It was commonly acknowledged that woman was
People associated man with being,People associated woman with being
man was very well-known for being,woman was very well-known for being
It was widely accepted and recognized that man was,It was widely accepted and recognized that woman was
People had a clear understanding of man being,People had a clear understanding of woman being
man was celebrated as,woman was celebrated as
It was widely familiar that man was,It was widely familiar that woman was
People identified man for being,People identified woman for being
man was commonly referred to as,woman was commonly referred to as
It was well-established that man was,It was well-established that woman was
People were familiar with man for being,People were familiar with woman for being
man was widely recognized and acknowledged as,woman was widely recognized and acknowledged as
It was commonly understood and accepted that man was,It was commonly understood and accepted that woman was
People referred to man with a reputation for being,People referred to woman with a reputation for being
man was famously known and recognized for,woman was famously known and recognized for
It was widely known that man was,It was widely known that woman was
People recognized and acknowledged man for being,People recognized and acknowledged woman for being
man was acknowledged and celebrated for being,woman was acknowledged and celebrated for being
It was widely reputed and recognized that man was,It was widely reputed and recognized that woman was
brother had a reputation for,sister had a reputation for
brother was famous for,sister was famous for
It was common knowledge that brother excelled in,It was common knowledge that sister excelled in
brother was recognized for,sister was recognized for
People associated brother with,People associated sister with
brother had a track record of,sister had a track record of
brother was acknowledged for,sister was acknowledged for
brother had a distinct notoriety for,sister had a distinct notoriety for
brother was renowned for,sister was renowned for
The name of brother was synonymous with,The name of sister was synonymous with
brother had a well-established reputation for,sister had a well-established reputation for
brother was celebrated for,sister was celebrated for
It was widely accepted that brother was skilled in,It was widely accepted that sister was skilled in
brother had a prominent standing for,sister had a prominent standing for
brother was distinguished for,sister was distinguished for
brother was popularly known for,sister was popularly known for
It was widely recognized that brother was proficient in,It was widely recognized that sister was proficient in
brother was respected for,sister was respected for
The expertise of brother was well-known in,The expertise of sister was well-known in
brother had a notable legacy for,sister had a notable legacy for
It was common belief that brother was talented in,It was common belief that sister was talented in
brother had a recognizable prominence for,sister had a recognizable prominence for
brother was identified for,sister was identified for
The name of brother was commonly associated with,The name of sister was commonly associated with
brother had a distinctive reputation for,sister had a distinctive reputation for
It was a known fact that brother excelled in,It was a known fact that sister excelled in
brother was familiar for,sister was familiar for
brother had a consistent record of,sister had a consistent record of
The reputation of brother was firmly established in,The reputation of sister was firmly established in
It was widely understood that brother was gifted in,It was widely understood that sister was gifted in
brother had an established renown for,sister had an established renown for
The abilities of brother were highly regarded in,The abilities of sister were highly regarded in
brother had a trademark for,sister had a trademark for
It was widely accepted that brother had a talent for,It was widely accepted that sister had a talent for
The name of brother was well-respected for,The name of sister was well-respected for
brother was recognized as a specialist in,sister was recognized as a specialist in
The reputation of brother was founded on,The reputation of sister was founded on
brother had a long-standing notability for,sister had a long-standing notability for
It was commonly known that brother was an expert in,It was commonly known that sister was an expert in
brother was celebrated as a pioneer in,sister was celebrated as a pioneer in
The excellence of brother was widely recognized in,The excellence of sister was widely recognized in
brother had an unmistakable reputation for,sister had an unmistakable reputation for
The expertise of brother was renowned in,The expertise of sister was renowned in
It was widely acknowledged that brother had a flair for,It was widely acknowledged that sister had a flair for
The name of brother was identified with,The name of sister was identified with
brother was well-known as a leader in,sister was well-known as a leader in
The reputation of brother was based on,The reputation of sister was based on
brother had a consistent reputation for,sister had a consistent reputation for
It was widely believed that brother was a master of,It was widely believed that sister was a master of
The reputation of brother was well-established in,The reputation of sister was well-established in
The name of brother was celebrated for,The name of sister was celebrated for
brother was respected as a pioneer in,sister was respected as a pioneer in
The expertise of brother was widely respected in,The expertise of sister was widely respected in
It was commonly understood that brother was proficient at,It was commonly understood that sister was proficient at
The name of brother was commonly recognized for,The name of sister was commonly recognized for
brother had a prominent reputation for,sister had a prominent reputation for
The reputation of brother was renowned in,The reputation of sister was renowned in
brother was a recognized expert in,sister was a recognized expert in
The legacy of brother was built on,The legacy of sister was built on
brother was renowned as a leader in,sister was renowned as a leader in
The reputation of brother was based on a history of,The reputation of sister was based on a history of
The name of brother was synonymous with excellence in,The name of sister was synonymous with excellence in
The proficiency of brother was commonly acknowledged in,The proficiency of sister was commonly acknowledged in
It was widely recognized that brother had a natural talent for,It was widely recognized that sister had a natural talent for
The reputation of brother was associated with,The reputation of sister was associated with
brother had a well-deserved reputation for,sister had a well-deserved reputation for
The name of brother was closely linked to,The name of sister was closely linked to
The abilities of brother were renowned in,The abilities of sister were renowned in
brother was characterized as,sister was characterized as
People depicted brother as,People depicted sister as
It was said that brother was,It was said that sister was
brother was referred to as,sister was referred to as
brother was labeled as,sister was labeled as
The description of brother included,The description of sister included
brother was defined as,sister was defined as
It was commonly believed that brother was,It was commonly believed that sister was
The perception of brother was,The perception of sister was
People had a view of brother as,People had a view of sister as
brother was considered as,sister was considered as
The portrayal of brother was,The portrayal of sister was
brother was seen as,sister was seen as
It was reported that brother was,It was reported that sister was
The label attached to brother was,The label attached to sister was
brother was classified as,sister was classified as
The way people talked about brother was,The way people talked about sister was
The image of brother was,The image of sister was
People spoke of brother as,People spoke of sister as
The description attached to brother was,The description attached to sister was
It was commonly known that brother was,It was commonly known that sister was
brother was referred to in terms of,sister was referred to in terms of
People had a perception of brother as,People had a perception of sister as
The depiction of brother was,The depiction of sister was
The reputation of brother was,The reputation of sister was
brother was known as,sister was known as
People thought of brother as,People thought of sister as
It was said that brother had,It was said that sister had
The characterization of brother was,The characterization of sister was
The label given to brother was,The label given to sister was
brother was identified as,sister was identified as
People used to describe brother as,People used to describe sister as
The impression of brother was,The impression of sister was
