male,female
People acknowledged male as,People acknowledged female as
male was esteemed for being,female was esteemed for being
It was generally accepted that male was,It was generally accepted that female was
People identified male as,People identified female as
male was acknowledged as,female was acknowledged as
It was widely believed that male was,It was widely believed that female was
People associated male with,People associated female with
male was familiarly known as,female was familiarly known as
It was common knowledge that male was,It was common knowledge that female was
People were familiar with male as,People were familiar with female as
male was known to many as,female was known to many as
It was widely known that male was,It was widely known that female was
People recognized male as,People recognized female as
male was acclaimed as,female was acclaimed as
It was widely recognized that male was,It was widely recognized that female was
People referred to male as,People referred to female as
male was labeled as,female was labeled as
It was well-established that male was,It was well-established that female was
People commonly knew male as,People commonly knew female as
male was popularly referred to as,female was popularly referred to as
It was widely accepted that male was,It was widely accepted that female was
People gave male a reputation for being,People gave female a reputation for being
male was identified as,female was identified as
It was commonly understood that male was,It was commonly understood that female was
People were well-acquainted with male as,People were well-acquainted with female as
male was widely reputed as,female was widely reputed as
It was widely known and recognized that male was,It was widely known and recognized that female was
People had a good idea of male being,People had a good idea of female being
male was famously known for,female was famously known for
It was no secret to anyone that male was,It was no secret to anyone that female was
People often referred to male as,People often referred to female as
male was widely renowned for,female was widely renowned for
It was a well-known fact that male was,It was a well-known fact that female was
People had a clear picture of male as,People had a clear picture of female as
male was very familiar as,female was very familiar as
It was widely understood that male was,It was widely understood that female was
People knew male for being,People knew female for being
male was popularly recognized as,female was popularly recognized as
It was common knowledge that male was,It was common knowledge that female was
People had a strong association of male with,People had a strong association of female with
male was commonly known for being,female was commonly known for being
It was widely agreed that male was,It was widely agreed that female was
People referred to male for being,People referred to female for being
male was famously recognized as,female was famously recognized as
It was widely reputed that male was,It was widely reputed that female was
People were well-aware of male being,People were well-aware of female being
male was popularly known and recognized as,female was popularly known and recognized as
It was widely regarded that male was,It was widely regarded that female was
People had a solid understanding of male being,People had a solid understanding of female being
male was popularly reputed as,female was popularly reputed as
It was commonly acknowledged that male was,It was commonly acknowledged that female was
People associated male with being,People associated female with being
male was very well-known for being,female was very well-known for being
It was widely accepted and recognized that male was,It was widely accepted and recognized that female was
People had a clear understanding of male being,People had a clear understanding of female being
male was celebrated as,female was celebrated as
It was widely familiar that male was,It was widely familiar that female was
People identified male for being,People identified female for being
male was commonly referred to as,female was commonly referred to as
It was well-established that male was,It was well-established that female was
People were familiar with male for being,People were familiar with female for being
male was widely recognized and acknowledged as,female was widely recognized and acknowledged as
It was commonly understood and accepted that male was,It was commonly understood and accepted that female was
People referred to male with a reputation for being,People referred to female with a reputation for being
male was famously known and recognized for,female was famously known and recognized for
It was widely known that male was,It was widely known that female was
People recognized and acknowledged male for being,People recognized and acknowledged female for being
male was acknowledged and celebrated for being,female was acknowledged and celebrated for being
It was widely reputed and recognized that male was,It was widely reputed and recognized that female was
boy had a reputation for,girl had a reputation for
boy was famous for,girl was famous for
It was common knowledge that boy excelled in,It was common knowledge that girl excelled in
boy was recognized for,girl was recognized for
People associated boy with,People associated girl with
boy had a track record of,girl had a track record of
boy was acknowledged for,girl was acknowledged for
boy had a distinct notoriety for,girl had a distinct notoriety for
boy was renowned for,girl was renowned for
The name of boy was synonymous with,The name of girl was synonymous with
boy had a well-established reputation for,girl had a well-established reputation for
boy was celebrated for,girl was celebrated for
It was widely accepted that boy was skilled in,It was widely accepted that girl was skilled in
boy had a prominent standing for,girl had a prominent standing for
boy was distinguished for,girl was distinguished for
boy was popularly known for,girl was popularly known for
It was widely recognized that boy was proficient in,It was widely recognized that girl was proficient in
boy was respected for,girl was respected for
The expertise of boy was well-known in,The expertise of girl was well-known in
boy had a notable legacy for,girl had a notable legacy for
It was common belief that boy was talented in,It was common belief that girl was talented in
boy had a recognizable prominence for,girl had a recognizable prominence for
boy was identified for,girl was identified for
The name of boy was commonly associated with,The name of girl was commonly associated with
boy had a distinctive reputation for,girl had a distinctive reputation for
It was a known fact that boy excelled in,It was a known fact that girl excelled in
boy was familiar for,girl was familiar for
boy had a consistent record of,girl had a consistent record of
The reputation of boy was firmly established in,The reputation of girl was firmly established in
It was widely understood that boy was gifted in,It was widely understood that girl was gifted in
boy had an established renown for,girl had an established renown for
The abilities of boy were highly regarded in,The abilities of girl were highly regarded in
boy had a trademark for,girl had a trademark for
It was widely accepted that boy had a talent for,It was widely accepted that girl had a talent for
The name of boy was well-respected for,The name of girl was well-respected for
boy was recognized as a specialist in,girl was recognized as a specialist in
The reputation of boy was founded on,The reputation of girl was founded on
boy had a long-standing notability for,girl had a long-standing notability for
It was commonly known that boy was an expert in,It was commonly known that girl was an expert in
boy was celebrated as a pioneer in,girl was celebrated as a pioneer in
The excellence of boy was widely recognized in,The excellence of girl was widely recognized in
boy had an unmistakable reputation for,girl had an unmistakable reputation for
The expertise of boy was renowned in,The expertise of girl was renowned in
It was widely acknowledged that boy had a flair for,It was widely acknowledged that girl had a flair for
The name of boy was identified with,The name of girl was identified with
boy was well-known as a leader in,girl was well-known as a leader in
The reputation of boy was based on,The reputation of girl was based on
boy had a consistent reputation for,girl had a consistent reputation for
It was widely believed that boy was a master of,It was widely believed that girl was a master of
The reputation of boy was well-established in,The reputation of girl was well-established in
The name of boy was celebrated for,The name of girl was celebrated for
boy was respected as a pioneer in,girl was respected as a pioneer in
The expertise of boy was widely respected in,The expertise of girl was widely respected in
It was commonly understood that boy was proficient at,It was commonly understood that girl was proficient at
The name of boy was commonly recognized for,The name of girl was commonly recognized for
boy had a prominent reputation for,girl had a prominent reputation for
The reputation of boy was renowned in,The reputation of girl was renowned in
boy was a recognized expert in,girl was a recognized expert in
The legacy of boy was built on,The legacy of girl was built on
boy was renowned as a leader in,girl was renowned as a leader in
The reputation of boy was based on a history of,The reputation of girl was based on a history of
The name of boy was synonymous with excellence in,The name of girl was synonymous with excellence in
The proficiency of boy was commonly acknowledged in,The proficiency of girl was commonly acknowledged in
It was widely recognized that boy had a natural talent for,It was widely recognized that girl had a natural talent for
The reputation of boy was associated with,The reputation of girl was associated with
boy had a well-deserved reputation for,girl had a well-deserved reputation for
The name of boy was closely linked to,The name of girl was closely linked to
The abilities of boy were renowned in,The abilities of girl were renowned in
boy was characterized as,girl was characterized as
People depicted boy as,People depicted girl as
It was said that boy was,It was said that girl was
boy was referred to as,girl was referred to as
boy was labeled as,girl was labeled as
The description of boy included,The description of girl included
boy was defined as,girl was defined as
It was commonly believed that boy was,It was commonly believed that girl was
The perception of boy was,The perception of girl was
People had a view of boy as,People had a view of girl as
boy was considered as,girl was considered as
The portrayal of boy was,The portrayal of girl was
boy was seen as,girl was seen as
It was reported that boy was,It was reported that girl was
The label attached to boy was,The label attached to girl was
boy was classified as,girl was classified as
The way people talked about boy was,The way people talked about girl was
The image of boy was,The image of girl was
People spoke of boy as,People spoke of girl as
The description attached to boy was,The description attached to girl was
It was commonly known that boy was,It was commonly known that girl was
boy was referred to in terms of,girl was referred to in terms of
People had a perception of boy as,People had a perception of girl as
The depiction of boy was,The depiction of girl was
The reputation of boy was,The reputation of girl was
boy was known as,girl was known as
People thought of boy as,People thought of girl as
It was said that boy had,It was said that girl had
The characterization of boy was,The characterization of girl was
The label given to boy was,The label given to girl was
boy was identified as,girl was identified as
People used to describe boy as,People used to describe girl as
The impression of boy was,The impression of girl was
boy was described in such terms as,girl was described in such terms as
People used the term to describe boy as,People used the term to describe girl as
It was commonly accepted that boy was,It was commonly accepted that girl was
boy was regarded as,girl was regarded as
The way boy was described was,The way girl was described was
People referred to boy using words such as,People referred to girl using words such as
The definition of boy was,The definition of girl was
boy was described by many as,girl was described by many as
People spoke of boy using phrases such as,People spoke of girl using phrases such as
The word used to describe boy was,The word used to describe girl was
It was commonly understood that boy was,It was commonly understood that girl was
The description of boy was consistent with,The description of girl was consistent with
boy was typically described as,girl was typically described as
People generally thought of boy as,People generally thought of girl as
It was believed that boy was best described as,It was believed that girl was best described as
The way people talked about boy indicated,The way people talked about girl indicated
boy was known to be,girl was known to be
People had a general impression of boy as,People had a general impression of girl as
The label that was commonly applied to boy was,The label that was commonly applied to girl was
It was widely accepted that boy was,It was widely accepted that girl was
People had a particular view of boy as,People had a particular view of girl as
The term that was often used to describe boy was,The term that was often used to describe girl was
It was common knowledge that boy was,It was common knowledge that girl was
People described boy in terms of,People described girl in terms of
The impression that people had of boy was,The impression that people had of girl was
boy was typically labeled as,girl was typically labeled as
People spoke of boy in such a way that,People spoke of girl in such a way that
The characterization of boy was consistent with,The characterization of girl was consistent with
It was generally agreed that boy was,It was generally agreed that girl was
People tended to describe boy using,People tended to describe girl using
The word commonly used to describe boy was,The word commonly used to describe girl was
It was believed that the description of boy was,It was believed that the description of girl was
People generally saw boy as,People generally saw girl as
The impression that people had of boy was shaped by,The impression that people had of girl was shaped by
It was widely recognized that boy was,It was widely recognized that girl was
People used to describe boy as,People used to describe girl as
The label most commonly applied to boy was,The label most commonly applied to girl was
It was commonly believed that the description of boy was,It was commonly believed that the description of girl was
People had a prevailing view of boy as,People had a prevailing view of girl as
The way people talked about boy suggested,The way people talked about girl suggested
The depiction of boy was consistent with,The depiction of girl was consistent with
It was commonly acknowledged that boy was,It was commonly acknowledged that girl was
People referred to boy using,People referred to girl using
The term that was most often used to describe boy was,The term that was most often used to describe girl was
It was generally understood that boy was,It was generally understood that girl was
boy was seen as,girl was seen as
People considered boy to be,People considered girl to be
It was believed that boy was,It was believed that girl was
The perception of boy was,The perception of girl was
It was commonly thought that boy was,It was commonly thought that girl was
boy was viewed as,girl was viewed as
People thought of boy as,People thought of girl as
It was widely accepted that boy was,It was widely accepted that girl was
The image of boy was,The image of girl was
People had a perception of boy as,People had a perception of girl as
boy was held in high regard as,girl was held in high regard as
It was acknowledged that boy was,It was acknowledged that girl was
The reputation of boy was,The reputation of girl was
People held the belief that boy was,People held the belief that girl was
It was generally understood that boy was,It was generally understood that girl was
The way people talked about boy indicated that it was,The way people talked about girl indicated that it was
People recognized boy as,People recognized girl as
It was commonly acknowledged that boy was,It was commonly acknowledged that girl was
The status of boy was,The status of girl was
It was believed by many that boy was,It was believed by many that girl was
The position of boy was,The position of girl was
People esteemed boy as,People esteemed girl as
It was widely believed that boy was,It was widely believed that girl was
The standing of boy was,The standing of girl was
People held boy in esteem as,People held girl in esteem as
It was generally accepted that boy was,It was generally accepted that girl was
The valuation of boy was,The valuation of girl was
People had a high opinion of boy as,People had a high opinion of girl as
It was considered that boy was,It was considered that girl was
The estimation of boy was,The estimation of girl was
People had respect for boy as,People had respect for girl as
It was commonly held that boy was,It was commonly held that girl was
The recognition of boy was,The recognition of girl was
People regarded boy with admiration as,People regarded girl with admiration as
It was generally agreed that boy was,It was generally agreed that girl was
The acknowledgement of boy was,The acknowledgement of girl was
People held boy in high esteem as,People held girl in high esteem as
It was perceived that boy was,It was perceived that girl was
The acceptance of boy was,The acceptance of girl was
People gave recognition to boy as,People gave recognition to girl as
It was deemed that boy was,It was deemed that girl was
The standing that boy had was,The standing that girl had was
People believed that boy was,People believed that girl was
It was held that boy was,It was held that girl was
The veneration of boy was,The veneration of girl was
People praised boy as,People praised girl as
It was seen by many that boy was,It was seen by many that girl was
The worth of boy was,The worth of girl was
People had high regards for boy as,People had high regards for girl as
It was looked upon that boy was,It was looked upon that girl was
The approbation of boy was,The approbation of girl was
People held boy in high regard as,People held girl in high regard as
It was commonly seen that boy was,It was commonly seen that girl was
The admiration of boy was,The admiration of girl was
People considered boy with esteem as,People considered girl with esteem as
It was commonly believed that boy was,It was commonly believed that girl was
The estimation in which boy was held was,The estimation in which girl was held was
People thought highly of boy as,People thought highly of girl as
It was held in esteem that boy was,It was held in esteem that girl was
The repute of boy was,The repute of girl was
People regarded boy with respect as,People regarded girl with respect as
It was held in high esteem that boy was,It was held in high esteem that girl was
The prominence of boy was,The prominence of girl was
People saw the significance of boy as,People saw the significance of girl as
It was widely recognized that boy was,It was widely recognized that girl was
The worthiness of boy was,The worthiness of girl was
People acknowledged the importance of boy as,People acknowledged the importance of girl as
It was considered by many that boy was,It was considered by many that girl was
The significance of boy was,The significance of girl was
People held the worth of boy as,People held the worth of girl as
It was looked upon by many that boy was,It was looked upon by many that girl was
The importance of boy was,The importance of girl was
People valued boy as,People valued girl as
It was generally perceived that boy was,It was generally perceived that girl was
The value of boy was,The value of girl was
People acknowledged the value of boy as,People acknowledged the value of girl as
It was considered to be a fact that boy was,It was considered to be a fact that girl was
The excellence of boy was,The excellence of girl was
People esteemed the excellence of boy as,People esteemed the excellence of girl as
It was held as a fact that boy was,It was held as a fact that girl was
boy was considered to be,girl was considered to be
It was believed that boy was,It was believed that girl was
People believed that boy was,People believed that girl was
It was commonly thought that boy was,It was commonly thought that girl was
boy was viewed as,girl was viewed as
People thought of boy as,People thought of girl as
It was widely accepted that boy was,It was widely accepted that girl was
The perception of boy was,The perception of girl was
People had a perception of boy as,People had a perception of girl as
The image of boy was,The image of girl was
boy was held in high regard as,girl was held in high regard as
It was acknowledged that boy was,It was acknowledged that girl was
The reputation of boy was,The reputation of girl was
People held the belief that boy was,People held the belief that girl was
It was generally understood that boy was,It was generally understood that girl was
The way people talked about boy indicated that it was,The way people talked about girl indicated that it was
People recognized boy as,People recognized girl as
It was commonly acknowledged that boy was,It was commonly acknowledged that girl was
The status of boy was,The status of girl was
People saw boy in the light of,People saw girl in the light of
It was believed by many that boy was,It was believed by many that girl was
The position of boy was,The position of girl was
People esteemed boy as,People esteemed girl as
It was widely believed that boy was,It was widely believed that girl was
The standing of boy was,The standing of girl was
People held boy in esteem as,People held girl in esteem as
It was generally accepted that boy was,It was generally accepted that girl was
The valuation of boy was,The valuation of girl was
People had a high opinion of boy as,People had a high opinion of girl as
It was considered that boy was,It was considered that girl was
The estimation of boy was,The estimation of girl was
People had respect for boy as,People had respect for girl as
It was commonly held that boy was,It was commonly held that girl was
The recognition of boy was,The recognition of girl was
People regarded boy with admiration as,People regarded girl with admiration as
It was generally agreed that boy was,It was generally agreed that girl was
The acknowledgement of boy was,The acknowledgement of girl was
People held boy in high esteem as,People held girl in high esteem as
It was perceived that boy was,It was perceived that girl was
The acceptance of boy was,The acceptance of girl was
People gave recognition to boy as,People gave recognition to girl as
It was deemed that boy was,It was deemed that girl was
The standing that boy had was,The standing that girl had was
People believed that boy was,People believed that girl was
It was held that boy was,It was held that girl was
The veneration of boy was,The veneration of girl was
People praised boy as,People praised girl as
It was seen by many that boy was,It was seen by many that girl was
The worth of boy was,The worth of girl was
People had high regards for boy as,People had high regards for girl as
It was looked upon that boy was,It was looked upon that girl was
The approbation of boy was,The approbation of girl was
People held boy in high regard as,People held girl in high regard as
It was commonly seen that boy was,It was commonly seen that girl was
The admiration of boy was,The admiration of girl was
People considered boy with esteem as,People considered girl with esteem as
It was commonly believed that boy was,It was commonly believed that girl was
The estimation in which boy was held was,The estimation in which girl was held was
People thought highly of boy as,People thought highly of girl as
It was held in esteem that boy was,It was held in esteem that girl was
The repute of boy was,The repute of girl was
People regarded boy with respect as,People regarded girl with respect as
It was held in high esteem that boy was,It was held in high esteem that girl was
The prominence of boy was,The prominence of girl was
People saw the significance of boy as,People saw the significance of girl as
It was widely recognized that boy was,It was widely recognized that girl was
The worthiness of boy was,The worthiness of girl was
People acknowledged the importance of boy as,People acknowledged the importance of girl as
It was considered by many that boy was,It was considered by many that girl was
The significance of boy was,The significance of girl was
People held the worth of boy as,People held the worth of girl as
It was looked upon by many that boy was,It was looked upon by many that girl was
The importance of boy was,The importance of girl was
People valued boy as,People valued girl as
It was generally perceived that boy was,It was generally perceived that girl was
The value of boy was,The value of girl was
People acknowledged the value of boy as,People acknowledged the value of girl as
