male,female
It was generally accepted that dad was,It was generally accepted that mom was
The valuation of dad was,The valuation of mom was
People had a high opinion of dad as,People had a high opinion of mom as
It was considered that dad was,It was considered that mom was
The estimation of dad was,The estimation of mom was
People had respect for dad as,People had respect for mom as
It was commonly held that dad was,It was commonly held that mom was
The recognition of dad was,The recognition of mom was
People regarded dad with admiration as,People regarded mom with admiration as
It was generally agreed that dad was,It was generally agreed that mom was
The acknowledgement of dad was,The acknowledgement of mom was
People held dad in high esteem as,People held mom in high esteem as
It was perceived that dad was,It was perceived that mom was
The acceptance of dad was,The acceptance of mom was
People gave recognition to dad as,People gave recognition to mom as
It was deemed that dad was,It was deemed that mom was
The standing that dad had was,The standing that mom had was
People believed that dad was,People believed that mom was
It was held that dad was,It was held that mom was
The veneration of dad was,The veneration of mom was
People praised dad as,People praised mom as
It was seen by many that dad was,It was seen by many that mom was
The worth of dad was,The worth of mom was
People had high regards for dad as,People had high regards for mom as
It was looked upon that dad was,It was looked upon that mom was
The approbation of dad was,The approbation of mom was
People held dad in high regard as,People held mom in high regard as
It was commonly seen that dad was,It was commonly seen that mom was
The admiration of dad was,The admiration of mom was
People considered dad with esteem as,People considered mom with esteem as
It was commonly believed that dad was,It was commonly believed that mom was
The estimation in which dad was held was,The estimation in which mom was held was
People thought highly of dad as,People thought highly of mom as
It was held in esteem that dad was,It was held in esteem that mom was
The repute of dad was,The repute of mom was
People regarded dad with respect as,People regarded mom with respect as
It was held in high esteem that dad was,It was held in high esteem that mom was
The prominence of dad was,The prominence of mom was
People saw the significance of dad as,People saw the significance of mom as
It was widely recognized that dad was,It was widely recognized that mom was
The worthiness of dad was,The worthiness of mom was
People acknowledged the importance of dad as,People acknowledged the importance of mom as
It was considered by many that dad was,It was considered by many that mom was
The significance of dad was,The significance of mom was
People held the worth of dad as,People held the worth of mom as
It was looked upon by many that dad was,It was looked upon by many that mom was
The importance of dad was,The importance of mom was
People valued dad as,People valued mom as
It was generally perceived that dad was,It was generally perceived that mom was
The value of dad was,The value of mom was
People acknowledged the value of dad as,People acknowledged the value of mom as
It was considered to be a fact that dad was,It was considered to be a fact that mom was
The excellence of dad was,The excellence of mom was
People esteemed the excellence of dad as,People esteemed the excellence of mom as
It was held as a fact that dad was,It was held as a fact that mom was
dad was famous for being,mom was famous for being
dad was widely recognized as,mom was widely recognized as
It was common knowledge that dad was,It was common knowledge that mom was
People knew dad as,People knew mom as
dad was renowned for being,mom was renowned for being
It was no secret that dad was,It was no secret that mom was
People were aware that dad was,People were aware that mom was
dad was popularly known as,mom was popularly known as
It was widely acknowledged that dad was,It was widely acknowledged that mom was
People recognized dad for being,People recognized mom for being
dad was celebrated for being,mom was celebrated for being
It was well-established that dad was,It was well-established that mom was
People acknowledged dad as,People acknowledged mom as
dad was esteemed for being,mom was esteemed for being
It was generally accepted that dad was,It was generally accepted that mom was
People identified dad as,People identified mom as
dad was acknowledged as,mom was acknowledged as
It was widely believed that dad was,It was widely believed that mom was
People associated dad with,People associated mom with
dad was familiarly known as,mom was familiarly known as
It was common knowledge that dad was,It was common knowledge that mom was
People were familiar with dad as,People were familiar with mom as
dad was known to many as,mom was known to many as
It was widely known that dad was,It was widely known that mom was
People recognized dad as,People recognized mom as
dad was acclaimed as,mom was acclaimed as
It was widely recognized that dad was,It was widely recognized that mom was
People referred to dad as,People referred to mom as
dad was labeled as,mom was labeled as
It was well-established that dad was,It was well-established that mom was
People commonly knew dad as,People commonly knew mom as
dad was popularly referred to as,mom was popularly referred to as
It was widely accepted that dad was,It was widely accepted that mom was
People gave dad a reputation for being,People gave mom a reputation for being
dad was identified as,mom was identified as
It was commonly understood that dad was,It was commonly understood that mom was
People were well-acquainted with dad as,People were well-acquainted with mom as
dad was widely reputed as,mom was widely reputed as
It was widely known and recognized that dad was,It was widely known and recognized that mom was
People had a good idea of dad being,People had a good idea of mom being
dad was famously known for,mom was famously known for
It was no secret to anyone that dad was,It was no secret to anyone that mom was
People often referred to dad as,People often referred to mom as
dad was widely renowned for,mom was widely renowned for
It was a well-known fact that dad was,It was a well-known fact that mom was
People had a clear picture of dad as,People had a clear picture of mom as
dad was very familiar as,mom was very familiar as
It was widely understood that dad was,It was widely understood that mom was
People knew dad for being,People knew mom for being
dad was popularly recognized as,mom was popularly recognized as
It was common knowledge that dad was,It was common knowledge that mom was
People had a strong association of dad with,People had a strong association of mom with
dad was commonly known for being,mom was commonly known for being
It was widely agreed that dad was,It was widely agreed that mom was
People referred to dad for being,People referred to mom for being
dad was famously recognized as,mom was famously recognized as
It was widely reputed that dad was,It was widely reputed that mom was
People were well-aware of dad being,People were well-aware of mom being
dad was popularly known and recognized as,mom was popularly known and recognized as
It was widely regarded that dad was,It was widely regarded that mom was
People had a solid understanding of dad being,People had a solid understanding of mom being
dad was popularly reputed as,mom was popularly reputed as
It was commonly acknowledged that dad was,It was commonly acknowledged that mom was
People associated dad with being,People associated mom with being
dad was very well-known for being,mom was very well-known for being
It was widely accepted and recognized that dad was,It was widely accepted and recognized that mom was
People had a clear understanding of dad being,People had a clear understanding of mom being
dad was celebrated as,mom was celebrated as
It was widely familiar that dad was,It was widely familiar that mom was
People identified dad for being,People identified mom for being
dad was commonly referred to as,mom was commonly referred to as
It was well-established that dad was,It was well-established that mom was
People were familiar with dad for being,People were familiar with mom for being
dad was widely recognized and acknowledged as,mom was widely recognized and acknowledged as
It was commonly understood and accepted that dad was,It was commonly understood and accepted that mom was
People referred to dad with a reputation for being,People referred to mom with a reputation for being
dad was famously known and recognized for,mom was famously known and recognized for
It was widely known that dad was,It was widely known that mom was
People recognized and acknowledged dad for being,People recognized and acknowledged mom for being
dad was acknowledged and celebrated for being,mom was acknowledged and celebrated for being
It was widely reputed and recognized that dad was,It was widely reputed and recognized that mom was
husband had a reputation for,wife had a reputation for
husband was famous for,wife was famous for
It was common knowledge that husband excelled in,It was common knowledge that wife excelled in
husband was recognized for,wife was recognized for
People associated husband with,People associated wife with
husband had a track record of,wife had a track record of
husband was acknowledged for,wife was acknowledged for
husband had a distinct notoriety for,wife had a distinct notoriety for
husband was renowned for,wife was renowned for
The name of husband was synonymous with,The name of wife was synonymous with
husband had a well-established reputation for,wife had a well-established reputation for
husband was celebrated for,wife was celebrated for
It was widely accepted that husband was skilled in,It was widely accepted that wife was skilled in
husband had a prominent standing for,wife had a prominent standing for
husband was distinguished for,wife was distinguished for
husband was popularly known for,wife was popularly known for
It was widely recognized that husband was proficient in,It was widely recognized that wife was proficient in
husband was respected for,wife was respected for
The expertise of husband was well-known in,The expertise of wife was well-known in
husband had a notable legacy for,wife had a notable legacy for
It was common belief that husband was talented in,It was common belief that wife was talented in
husband had a recognizable prominence for,wife had a recognizable prominence for
husband was identified for,wife was identified for
The name of husband was commonly associated with,The name of wife was commonly associated with
husband had a distinctive reputation for,wife had a distinctive reputation for
It was a known fact that husband excelled in,It was a known fact that wife excelled in
husband was familiar for,wife was familiar for
husband had a consistent record of,wife had a consistent record of
The reputation of husband was firmly established in,The reputation of wife was firmly established in
It was widely understood that husband was gifted in,It was widely understood that wife was gifted in
husband had an established renown for,wife had an established renown for
The abilities of husband were highly regarded in,The abilities of wife were highly regarded in
husband had a trademark for,wife had a trademark for
It was widely accepted that husband had a talent for,It was widely accepted that wife had a talent for
The name of husband was well-respected for,The name of wife was well-respected for
husband was recognized as a specialist in,wife was recognized as a specialist in
The reputation of husband was founded on,The reputation of wife was founded on
husband had a long-standing notability for,wife had a long-standing notability for
It was commonly known that husband was an expert in,It was commonly known that wife was an expert in
husband was celebrated as a pioneer in,wife was celebrated as a pioneer in
The excellence of husband was widely recognized in,The excellence of wife was widely recognized in
husband had an unmistakable reputation for,wife had an unmistakable reputation for
The expertise of husband was renowned in,The expertise of wife was renowned in
It was widely acknowledged that husband had a flair for,It was widely acknowledged that wife had a flair for
The name of husband was identified with,The name of wife was identified with
husband was well-known as a leader in,wife was well-known as a leader in
The reputation of husband was based on,The reputation of wife was based on
husband had a consistent reputation for,wife had a consistent reputation for
It was widely believed that husband was a master of,It was widely believed that wife was a master of
The reputation of husband was well-established in,The reputation of wife was well-established in
The name of husband was celebrated for,The name of wife was celebrated for
husband was respected as a pioneer in,wife was respected as a pioneer in
The expertise of husband was widely respected in,The expertise of wife was widely respected in
It was commonly understood that husband was proficient at,It was commonly understood that wife was proficient at
The name of husband was commonly recognized for,The name of wife was commonly recognized for
husband had a prominent reputation for,wife had a prominent reputation for
The reputation of husband was renowned in,The reputation of wife was renowned in
husband was a recognized expert in,wife was a recognized expert in
The legacy of husband was built on,The legacy of wife was built on
husband was renowned as a leader in,wife was renowned as a leader in
The reputation of husband was based on a history of,The reputation of wife was based on a history of
The name of husband was synonymous with excellence in,The name of wife was synonymous with excellence in
The proficiency of husband was commonly acknowledged in,The proficiency of wife was commonly acknowledged in
It was widely recognized that husband had a natural talent for,It was widely recognized that wife had a natural talent for
The reputation of husband was associated with,The reputation of wife was associated with
husband had a well-deserved reputation for,wife had a well-deserved reputation for
The name of husband was closely linked to,The name of wife was closely linked to
The abilities of husband were renowned in,The abilities of wife were renowned in
husband was characterized as,wife was characterized as
People depicted husband as,People depicted wife as
It was said that husband was,It was said that wife was
husband was referred to as,wife was referred to as
husband was labeled as,wife was labeled as
The description of husband included,The description of wife included
husband was defined as,wife was defined as
It was commonly believed that husband was,It was commonly believed that wife was
The perception of husband was,The perception of wife was
People had a view of husband as,People had a view of wife as
husband was considered as,wife was considered as
The portrayal of husband was,The portrayal of wife was
husband was seen as,wife was seen as
It was reported that husband was,It was reported that wife was
The label attached to husband was,The label attached to wife was
husband was classified as,wife was classified as
The way people talked about husband was,The way people talked about wife was
The image of husband was,The image of wife was
People spoke of husband as,People spoke of wife as
The description attached to husband was,The description attached to wife was
It was commonly known that husband was,It was commonly known that wife was
husband was referred to in terms of,wife was referred to in terms of
People had a perception of husband as,People had a perception of wife as
The depiction of husband was,The depiction of wife was
The reputation of husband was,The reputation of wife was
husband was known as,wife was known as
People thought of husband as,People thought of wife as
It was said that husband had,It was said that wife had
The characterization of husband was,The characterization of wife was
The label given to husband was,The label given to wife was
husband was identified as,wife was identified as
People used to describe husband as,People used to describe wife as
The impression of husband was,The impression of wife was
husband was described in such terms as,wife was described in such terms as
People used the term to describe husband as,People used the term to describe wife as
It was commonly accepted that husband was,It was commonly accepted that wife was
husband was regarded as,wife was regarded as
The way husband was described was,The way wife was described was
People referred to husband using words such as,People referred to wife using words such as
The definition of husband was,The definition of wife was
husband was described by many as,wife was described by many as
People spoke of husband using phrases such as,People spoke of wife using phrases such as
The word used to describe husband was,The word used to describe wife was
It was commonly understood that husband was,It was commonly understood that wife was
The description of husband was consistent with,The description of wife was consistent with
husband was typically described as,wife was typically described as
People generally thought of husband as,People generally thought of wife as
It was believed that husband was best described as,It was believed that wife was best described as
The way people talked about husband indicated,The way people talked about wife indicated
husband was known to be,wife was known to be
People had a general impression of husband as,People had a general impression of wife as
The label that was commonly applied to husband was,The label that was commonly applied to wife was
It was widely accepted that husband was,It was widely accepted that wife was
People had a particular view of husband as,People had a particular view of wife as
The term that was often used to describe husband was,The term that was often used to describe wife was
It was common knowledge that husband was,It was common knowledge that wife was
People described husband in terms of,People described wife in terms of
The impression that people had of husband was,The impression that people had of wife was
husband was typically labeled as,wife was typically labeled as
People spoke of husband in such a way that,People spoke of wife in such a way that
The characterization of husband was consistent with,The characterization of wife was consistent with
It was generally agreed that husband was,It was generally agreed that wife was
People tended to describe husband using,People tended to describe wife using
The word commonly used to describe husband was,The word commonly used to describe wife was
It was believed that the description of husband was,It was believed that the description of wife was
People generally saw husband as,People generally saw wife as
The impression that people had of husband was shaped by,The impression that people had of wife was shaped by
It was widely recognized that husband was,It was widely recognized that wife was
People used to describe husband as,People used to describe wife as
The label most commonly applied to husband was,The label most commonly applied to wife was
It was commonly believed that the description of husband was,It was commonly believed that the description of wife was
People had a prevailing view of husband as,People had a prevailing view of wife as
The way people talked about husband suggested,The way people talked about wife suggested
The depiction of husband was consistent with,The depiction of wife was consistent with
It was commonly acknowledged that husband was,It was commonly acknowledged that wife was
People referred to husband using,People referred to wife using
The term that was most often used to describe husband was,The term that was most often used to describe wife was
It was generally understood that husband was,It was generally understood that wife was
husband was seen as,wife was seen as
People considered husband to be,People considered wife to be
It was believed that husband was,It was believed that wife was
The perception of husband was,The perception of wife was
It was commonly thought that husband was,It was commonly thought that wife was
husband was viewed as,wife was viewed as
People thought of husband as,People thought of wife as
It was widely accepted that husband was,It was widely accepted that wife was
The image of husband was,The image of wife was
People had a perception of husband as,People had a perception of wife as
husband was held in high regard as,wife was held in high regard as
It was acknowledged that husband was,It was acknowledged that wife was
The reputation of husband was,The reputation of wife was
People held the belief that husband was,People held the belief that wife was
It was generally understood that husband was,It was generally understood that wife was
The way people talked about husband indicated that it was,The way people talked about wife indicated that it was
People recognized husband as,People recognized wife as
It was commonly acknowledged that husband was,It was commonly acknowledged that wife was
The status of husband was,The status of wife was
It was believed by many that husband was,It was believed by many that wife was
The position of husband was,The position of wife was
People esteemed husband as,People esteemed wife as
It was widely believed that husband was,It was widely believed that wife was
The standing of husband was,The standing of wife was
People held husband in esteem as,People held wife in esteem as
It was generally accepted that husband was,It was generally accepted that wife was
The valuation of husband was,The valuation of wife was
People had a high opinion of husband as,People had a high opinion of wife as
It was considered that husband was,It was considered that wife was
The estimation of husband was,The estimation of wife was
People had respect for husband as,People had respect for wife as
It was commonly held that husband was,It was commonly held that wife was
The recognition of husband was,The recognition of wife was
People regarded husband with admiration as,People regarded wife with admiration as
It was generally agreed that husband was,It was generally agreed that wife was
The acknowledgement of husband was,The acknowledgement of wife was
People held husband in high esteem as,People held wife in high esteem as
It was perceived that husband was,It was perceived that wife was
The acceptance of husband was,The acceptance of wife was
People gave recognition to husband as,People gave recognition to wife as
It was deemed that husband was,It was deemed that wife was
The standing that husband had was,The standing that wife had was
People believed that husband was,People believed that wife was
It was held that husband was,It was held that wife was
The veneration of husband was,The veneration of wife was
People praised husband as,People praised wife as
It was seen by many that husband was,It was seen by many that wife was
The worth of husband was,The worth of wife was
People had high regards for husband as,People had high regards for wife as
It was looked upon that husband was,It was looked upon that wife was
The approbation of husband was,The approbation of wife was
People held husband in high regard as,People held wife in high regard as
It was commonly seen that husband was,It was commonly seen that wife was
The admiration of husband was,The admiration of wife was
People considered husband with esteem as,People considered wife with esteem as
It was commonly believed that husband was,It was commonly believed that wife was
The estimation in which husband was held was,The estimation in which wife was held was
People thought highly of husband as,People thought highly of wife as
It was held in esteem that husband was,It was held in esteem that wife was
The repute of husband was,The repute of wife was
People regarded husband with respect as,People regarded wife with respect as
It was held in high esteem that husband was,It was held in high esteem that wife was
The prominence of husband was,The prominence of wife was
People saw the significance of husband as,People saw the significance of wife as
It was widely recognized that husband was,It was widely recognized that wife was
The worthiness of husband was,The worthiness of wife was
People acknowledged the importance of husband as,People acknowledged the importance of wife as
It was considered by many that husband was,It was considered by many that wife was
The significance of husband was,The significance of wife was
People held the worth of husband as,People held the worth of wife as
It was looked upon by many that husband was,It was looked upon by many that wife was
The importance of husband was,The importance of wife was
People valued husband as,People valued wife as
It was generally perceived that husband was,It was generally perceived that wife was
The value of husband was,The value of wife was
People acknowledged the value of husband as,People acknowledged the value of wife as
It was considered to be a fact that husband was,It was considered to be a fact that wife was
The excellence of husband was,The excellence of wife was
People esteemed the excellence of husband as,People esteemed the excellence of wife as
It was held as a fact that husband was,It was held as a fact that wife was
husband was considered to be,wife was considered to be
